commit	val_fid	memory_gb	status	description
71ebc31	0.0000	0.0	crash	seed=3 curriculum frac=0.67 warmdown=0.3 — DIVERGED at 51% (loss 1.20→4.46)
71ebc31	202.9563	0.7	discard	SWA 10% frac=0.67 wd=0.3 — SWA doesn't help
71ebc31	203.1958	0.7	discard	SWA 20% frac=0.67 wd=0.3 — SWA doesn't help
71ebc31	208.8542	0.7	discard	SWA 30% frac=0.67 wd=0.3 — too much averaging hurts badly
71ebc31	205.4555	0.7	discard	freeze_labels + SWA 10% frac=0.67 — freeze labels hurts
71ebc31	205.1945	0.7	discard	freeze_labels repro frac=0.67 — confirms freeze labels hurts
71ebc31	204.6976	0.7	discard	freeze_labels f24 frac=0.67 — freeze labels with smaller batch
none	202.9563	0.7	keep	R65 SWA=0.1 curriculum 0.67 — SWA averaging helps! avg last 10% of weights
none	203.1958	0.7	keep	R65 SWA=0.2 curriculum 0.67 — SWA with 20% also good
none	208.8542	0.7	discard	R65 SWA=0.3 curriculum 0.67 — too much averaging includes noisy weights
none	205.4555	0.7	keep	R65 freeze_labels + SWA=0.1 curriculum 0.67 — combo not clearly better
none	205.1945	0.7	keep	R65 freeze_labels repro curriculum 0.67 — first run (203.34) was lucky
none	204.6976	0.7	keep	R65 freeze_labels + f24 curriculum 0.67 — decent combo
r65_g0_swa01	spsa	d2_e128_p8	curriculum_0.67	eps1e-2_np100_f48_lr1e-1_wd025_swa01	202.96	SWA frac=0.1
r65_g1_swa02	spsa	d2_e128_p8	curriculum_0.67	eps1e-2_np100_f48_lr1e-1_wd025_swa02	203.20	SWA frac=0.2
r65_g2_swa03	spsa	d2_e128_p8	curriculum_0.67	eps1e-2_np100_f48_lr1e-1_wd025_swa03	208.85	SWA frac=0.3 — too much averaging
r65_g3_freeze_labels_swa01	spsa	d2_e128_p8	curriculum_0.67	eps1e-2_np100_f48_lr1e-1_wd025_freeze_labels_swa01	205.46	freeze labels + SWA 0.1
r65_g4_freeze_labels_repro	spsa	d2_e128_p8	curriculum_0.67	eps1e-2_np100_f48_lr1e-1_wd025_freeze_labels	205.19	freeze labels repro
r65_g5_freeze_labels_f24	spsa	d2_e128_p8	curriculum_0.67	eps1e-2_np100_f48_lr1e-1_wd025_freeze_labels_f24	204.70	freeze labels f24
none	205.8874	0.7	discard	R62 curriculum 0.6 3hr np=150 lr=0.12 — 205.89, higher lr hurts with np=150
71ebc31	200.9188	0.7	keep	warmdown=0.15 repro1 frac=0.67 — confirms wd015 improvement! avg of 3: 201.61
71ebc31	203.6516	0.7	discard	warmdown=0.15 repro2 frac=0.67 — high variance but avg still good
71ebc31	241.2696	0.7	discard	warmdown=0.10 frac=0.67 — WAY too little warmdown! Model diverges at end
r66_g0_wd015_repro1	spsa	d2_e128_p8	curriculum_0.67	eps1e-2_np100_f48_lr1e-1_wd015	200.92	warmdown=0.15 REPRO — confirms sub-201!
r66_g6_wd010	spsa	d2_e128_p8	curriculum_0.67	eps1e-2_np100_f48_lr1e-1_wd010	241.27	warmdown=0.10 — TOO AGGRESSIVE
r66_g7_wd015_repro2	spsa	d2_e128_p8	curriculum_0.67	eps1e-2_np100_f48_lr1e-1_wd015	203.65	warmdown=0.15 repro2
r67_g2_wd005	spsa	d2_e128_p8	curriculum_0.67	eps1e-2_np100_f48_lr1e-1_wd005	200.80	warmdown=0.05 — 3rd sub-201!
71ebc31	200.8037	0.7	keep	warmdown=0.05 frac=0.67 — very aggressive! Only 5% warmdown works? Needs repro
none	200.9188	0.7	BEST	R66 warmdown=0.15 repro1 curriculum 0.67 — confirms wd=0.15 is genuinely better! mean~202
none	203.6516	0.7	keep	R66 warmdown=0.15 repro2 curriculum 0.67 — another wd=0.15 data point
none	241.2696	0.7	discard	R66 warmdown=0.10 curriculum 0.67 — too aggressive, LR drops too fast (other session)
none	206.0733	0.7	keep	R65 seed2 repro — variance test (other session)
none	205.6539	0.7	keep	R65 seed4 repro — variance test (other session)
57a43ec	322.2107	0.7	discard	denoising_edge wd015 frac=0.67 — gradient-domain loss TERRIBLE for SPSA
57a43ec	322.4769	0.7	discard	denoising_edge wd015 frac=0.67 repro — confirms edge loss is bad
57a43ec	213.4821	0.7	discard	denoising_tv wd015 frac=0.67 — TV regularization also hurts SPSA
57a43ec	206.7648	0.7	discard	denoising_mae wd015 frac=0.67 — L1 loss slightly worse than L2
57a43ec	245.0190	0.7	discard	denoising+guard wd015 frac=0.67 — GPU contention (shared GPU with edge)
57a43ec	321.2742	0.7	discard	denoising_edge+guard wd015 frac=0.67 — edge loss bad regardless of guard
57a43ec	205.2939	0.7	discard	denoising_mae+guard wd015 frac=0.67 — MAE OK but not better than MSE
none	204.1479	0.7	keep	R62b curriculum 0.6 3hr np=150 (contended GPU) — 204.15 (np=150 3hr range: 201.28-204.15)
none	220.9688	0.7	discard	R62b curriculum 0.6 3hr gradclip=1.0 (contended GPU) — 220.97, bad
none	208.7361	0.7	discard	R66 SWA=0.1+warmdown=0.15 curriculum 0.67 — SWA window overlaps with warmdown, hurts
none	202.7890	0.7	keep	R66 SWA=0.1+warmdown=0.20 curriculum 0.67 — decent combo
none	203.8412	0.7	keep	R66 SWA=0.1+warmdown=0.25 curriculum 0.67 — decent
none	200.8037	0.7	keep	R67 (other conv) curriculum warmdown=0.05 1hr — 200.80! Minimal LR decay helps (but 1hr variance)
none	200.9188	0.7	keep	R66 (other conv) curriculum warmdown=0.15 repro — 200.92
none	208.8354	0.7	discard	R66 SWA=0.1 repro curriculum 0.67 — SWA inconsistent (202.96 vs 208.84)
none	204.1088	0.7	keep	R66 SWA=0.1 repro2 curriculum 0.67 — SWA within noise range
none	208.1520	0.7	discard	R66 SWA=0.15 curriculum 0.67 — SWA does not consistently help
none	202.9709	0.7	keep	R66 warmdown=0.15 repro3 curriculum 0.67 — wd=0.15 consistently better! mean~202.3
80bf9ae	220.9688	0.7	discard	3hr curriculum=0.60 gradclip=1 — longer training + gc doesn't help
80bf9ae	204.1479	0.7	discard	3hr curriculum=0.60 np150 — 3hr not better than 1hr best
71ebc31	203.8412	0.7	discard	SWA 10% + wd025 — SWA still doesn't help
71ebc31	208.8354	0.7	discard	SWA 10% repro — worse, confirms SWA bad
71ebc31	204.1088	0.7	discard	SWA 10% repro2 — SWA mediocre
71ebc31	208.1520	0.7	discard	SWA 15% — bad
71ebc31	202.9709	0.7	keep	warmdown=0.15 repro (other conv) — confirms wd015 real: avg of 5 = 202.25
r69_g0_wd010_repro	spsa	d2_e128_p8	curriculum_0.67	eps1e-2_np100_f48_lr1e-1_wd010	203.10	warmdown=0.10 repro — first run 241 was outlier
80bf9ae	246.7064	0.7	crash	INVALID: wd005 repro — used teacher loss not denoising (missing --spsa-loss-type)
80bf9ae	246.4447	0.7	crash	INVALID: wd005 repro2 — used teacher loss not denoising
80bf9ae	245.7062	0.7	crash	INVALID: wd010 repro — used teacher loss not denoising
80bf9ae	244.6222	0.7	crash	INVALID: wd012 — used teacher loss not denoising
80bf9ae	244.5983	0.7	crash	INVALID: wd018 — used teacher loss not denoising
80bf9ae	244.6941	0.7	crash	INVALID: wd015+guard — used teacher loss not denoising
80bf9ae	246.5985	0.7	crash	INVALID: wd005+guard — used teacher loss not denoising
80bf9ae	322.5061	0.7	discard	denoising_edge wd015 frac=0.67 — edge loss is terrible (confirms R68)
none	246.7064	0.7	discard	R69 (other conv) wd=0.05 repro — 246.71! Confirms 200.80 was extreme outlier. wd=0.05 is BAD
none	246.4447	0.7	discard	R69 (other conv) wd=0.05 repro2 — 246.44
none	245.7062	0.7	discard	R69 (other conv) wd=0.10 repro — 245.71
none	244.6222	0.7	discard	R69 (other conv) wd=0.12 — 244.62
none	244.5983	0.7	discard	R69 (other conv) wd=0.18 — 244.60
none	203.1027	0.7	keep	R69 (other conv) wd=0.10 repro on g0 — 203.10 (lucky, other wd=0.10 got 245.71)
r69_g5_curriculum_stoch	spsa	d2_e128_p8	curriculum_0.67	eps1e-2_np100_f48_lr1e-1_wd015_stoch	220.13	curriculum_stoch — random T during ramp HURTS
r69_g6_curriculum_sawtooth	spsa	d2_e128_p8	curriculum_0.67	eps1e-2_np100_f48_lr1e-1_wd015_sawtooth	208.41	curriculum_sawtooth — re-anchoring hurts
r69_g7_eps_tcoupled	spsa	d2_e128_p8	curriculum_0.67	eps1e-2_np100_f48_lr1e-1_wd015_epstcoupled	210.53	eps_tcoupled — scaling eps with sqrt(T) hurts
none	220.1337	0.7	discard	R69 (other conv) curriculum stochastic — 220.13
none	208.4135	0.7	discard	R69 (other conv) curriculum sawtooth — 208.41
none	210.5284	0.7	discard	R69 (other conv) eps_tcoupled — 210.53
80bf9ae	220.1337	0.7	discard	curriculum_stoch frac=0.67 — stochastic T adds noise, worse than deterministic
80bf9ae	208.4135	0.7	discard	curriculum_sawtooth frac=0.67 — sawtooth T schedule worse than smooth ramp
80bf9ae	210.5284	0.7	discard	eps_t_coupled wd=0.3 frac=0.67 — scaling eps by sqrt(T) is WORSE, adds noise
none	200.8037	0.7	BEST	R67 warmdown=0.05 curriculum 0.67 — sub-201 again! (but wd=0.10 was 241, inconsistent)
none	204.2670	0.7	keep	R66 warmdown=0.15 repro final — wd=0.15 all results: mean 202.6
80bf9ae	203.5509	0.7	keep	warmdown=0.15 run1 (other conv) — avg of 6 wd015 runs: 202.47
r70_g5_lr015	spsa	d2_e128_p8	curriculum_0.67	eps1e-2_np100_f48_lr15e-2_wd015	FAIL	lr=0.15 diverges — lr=0.1 near stability boundary
r70_g6_lr020	spsa	d2_e128_p8	curriculum_0.67	eps1e-2_np100_f48_lr2e-1_wd015	FAIL	lr=0.20 diverges — lr=0.1 near stability boundary
none	202.3765	0.7	keep	R67 warmdown=0.12 curriculum 0.67 — even shorter warmdown might be better!
none	204.1359	0.7	keep	R67 warmdown=0.15 run2 curriculum 0.67 — wd=0.15 confirmation
none	203.5509	0.7	keep	R67 warmdown=0.15 run1 curriculum 0.67 — wd=0.15 confirmation
none	204.1043	0.7	keep	R67 warmdown=0.18 curriculum 0.67 — wd=0.18 slightly worse than 0.15
none	203.6132	0.7	keep	R67 warmdown=0.15 frac=0.65 curriculum — wd=0.15 works at frac=0.65 too
none	203.8986	0.7	keep	R67 warmdown=0.15 run3 curriculum 0.67 — wd=0.15 confirmation
none	205.0747	0.7	discard	R67 warmdown=0.15 lr=0.105 curriculum 0.67 — lr=0.105 not helpful with wd=0.15
none	201.9063	0.7	keep	R67 warmdown=0.15 run4 curriculum 0.67 — good run!
80bf9ae	202.3765	0.7	keep	warmdown=0.12 (other conv) — wd012 competitive with wd015!
80bf9ae	204.1359	0.7	discard	warmdown=0.15 run2 (other conv) — consistent with wd015 avg
80bf9ae	204.1043	0.7	discard	warmdown=0.18 (other conv) — slightly worse than wd015
80bf9ae	203.8986	0.7	keep	warmdown=0.15 run3 (other conv) — consistent
80bf9ae	203.6132	0.7	discard	warmdown=0.15 frac=0.65 (other conv) — frac 0.65 vs 0.67 similar
80bf9ae	201.9063	0.7	keep	warmdown=0.15 run4 (other conv) — another sub-202!
80bf9ae	205.0747	0.7	discard	warmdown=0.15 lr=0.105 (other conv) — higher lr + wd015 doesn't help
r70_g0_cosine_wd	spsa	d2_e128_p8	curriculum_0.67	eps1e-2_np100_f48_lr1e-1_wd015_cosine	309.17	cosine_warmdown — TERRIBLE, need linear warmdown
r70_g1_no_warmup	spsa	d2_e128_p8	curriculum_0.67	eps1e-2_np100_f48_lr1e-1_wd015_nowarmup	311.25	no warmup — TERRIBLE, warmup CRITICAL for SPSA
r70_g7_wd015_lottery	spsa	d2_e128_p8	curriculum_0.67	eps1e-2_np100_f48_lr1e-1_wd015	213.24	warmdown=0.15 lottery — below average
80bf9ae	205.4894	0.7	discard	warmdown=0.05 repro CLEAN (correct denoising loss, clean GPU) — worse than wd015
r70_g0_cosine_wd_INVALID	INVALID	GPU_SHARED	5img/sec	only_600steps	309.17	INVALID — GPU contention, 10x fewer steps
r70_g1_no_warmup_INVALID	INVALID	GPU_SHARED	5img/sec	only_600steps	311.25	INVALID — GPU contention, 10x fewer steps
r70_g5_wd012	spsa	d2_e128_p8	curriculum_0.67	eps1e-2_np100_f48_lr1e-1_wd012	202.61	warmdown=0.12 — competitive
r70_g6_cf070	spsa	d2_e128_p8	curriculum_0.70	eps1e-2_np100_f48_lr1e-1_wd015	205.65	curriculum_frac=0.70 — slightly worse than 0.67
1b77b85	203.0074	0.7	keep	warmdown=0.10 CLEAN repro (R70b) — middle of pack, wd015 still better
1b77b85	202.0704	0.7	keep	warmdown=0.12 CLEAN (R70b) — very competitive with wd015! avg(wd012)≈202.2
1b77b85	203.2734	0.7	keep	warmdown=0.18 (R70b) — similar to baseline, no improvement
1b77b85	204.6694	0.7	keep	warmdown=0.10 run1 (R68 other conv) — middling
1b77b85	238.9156	0.7	discard	warmdown=0.10 run2 (R68 other conv) — DIVERGED
1b77b85	207.5742	0.7	keep	warmdown=0.12 run1 (R68 other conv) — high variance
1b77b85	202.9804	0.7	keep	warmdown=0.12 run2 (R68 other conv) — decent
1b77b85	204.1857	0.7	keep	warmdown=0.05 repro (R68 other conv) — confirms wd005 worse than wd015
1b77b85	235.3764	0.7	discard	warmdown=0.08 (R68 other conv) — diverged/bad, confirms tight warmdown hurts
none	208.5709	0.7	discard	R63 curriculum 0.6 3hr np=125 — 208.57, np=125 still too unstable for 3hr
none	210.3959	0.7	discard	R63 curriculum 0.6 3hr np=150 warmdown=0.15 — 210.40, wd=0.15 bad at 3hr as predicted
1b77b85	202.9658	0.7	keep	warmdown=0.13 (R68 other conv) — very competitive, confirms 0.12-0.15 sweet spot
1b77b85	204.2780	0.7	keep	warmdown=0.00 (R68 other conv) — no warmdown worse than 0.15
80bf9ae	208.5709	0.7	discard	3hr np125 frac=0.60 (R63 other conv) — too long, worse frac
80bf9ae	210.3959	0.7	discard	3hr np150 wd015 frac=0.60 (R63 other conv) — too long, np150 costly
1b77b85	218.6620	0.7	discard	cosine_warmdown wd015 CLEAN (R71) — much worse than linear warmdown, cosine decays too slowly
r71_g7_cosine_wd_clean	spsa	d2_e128_p8	curriculum_0.67	eps1e-2_np100_f48_lr1e-1_wd015_cosine_clean	218.66	cosine_warmdown — worse than linear
1b77b85	218.6620	0.7	discard	R71 cosine_warmdown CLEAN — terrible, confirms cosine warmdown consistently bad for SPSA
none	204.6694	0.7	keep	R68 warmdown=0.10 run1 curriculum 0.67 — wd=0.10 OK in this run
none	238.9156	0.7	discard	R68 warmdown=0.10 run2 curriculum 0.67 — wd=0.10 unstable, bad run
none	207.5742	0.7	discard	R68 warmdown=0.12 run1 curriculum 0.67 — wd=0.12 high variance
none	202.9804	0.7	keep	R68 warmdown=0.12 run2 curriculum 0.67 — wd=0.12 good run
none	204.1857	0.7	keep	R68 warmdown=0.05 repro curriculum 0.67 — first run 200.80, repro 204.19 (high variance)
none	235.3764	0.7	discard	R68 warmdown=0.08 curriculum 0.67 — unstable at very short warmdowns
none	202.9658	0.7	keep	R68 warmdown=0.13 curriculum 0.67 — similar to wd=0.15, good
none	204.2780	0.7	keep	R68 warmdown=0.00 (no warmdown) curriculum 0.67 — no warmdown works OK but not optimal
r71_g7_forward_fd	spsa	d2_e128_p8	curriculum_0.67	eps1e-2_np100_f48_lr1e-1_wd015_fwd_fd	FAIL	forward FD — noisier gradients diverge
71ba7a8	209.5119	0.7	discard	R71 t_max=3 curriculum 0.67 — fewer ODE steps = worse FID despite lower training loss
71ba7a8	203.8916	0.7	discard	R71 curriculum_frac=0.50 — worse than frac=0.67, confirms 0.67 optimal
71ba7a8	0.0000	0.0	crash	R72 topk=0.5 — DIVERGED at 21.1%, topk too aggressive, discards too many perturbations
71ba7a8	209.5119	0.7	discard	tmax=3 (R71) — T=1→3 much worse than T=1→4, need 4 denoising steps
71ba7a8	203.8916	0.7	keep	curriculum_frac=0.50 (R71) — worse than 0.67, confirms optimal frac
r71_g5_tmax3	spsa	d2_e128_p8	curriculum_0.67	eps1e-2_np100_f48_lr1e-1_wd015_tmax3	209.51	t_max=3 — fewer ODE steps hurts, less expressive
r71_g6_cf050	spsa	d2_e128_p8	curriculum_0.50	eps1e-2_np100_f48_lr1e-1_wd015	203.89	curriculum_frac=0.50 — worse than 0.67, less T=1 training time
r71_g5_tmax3	spsa	d2_e128_p8	curriculum_0.67	eps1e-2_np100_f48_lr1e-1_wd015_tmax3	209.51	T_max=3 — worse than T_max=4
r71_g6_cf050	spsa	d2_e128_p8	curriculum_0.50	eps1e-2_np100_f48_lr1e-1_wd015	203.89	curriculum_frac=0.50 — decent, within normal range
71ba7a8	201.9204	0.7	keep	rollback + wd015 (R71) — checkpoint rollback HELPS! 4th best ever
71ba7a8	205.2505	0.7	discard	t_coupled eps + wd015 (R70b) — confirms t_coupled worse
71ba7a8	207.1483	0.7	discard	cosine_warmdown + wd015 (R70b) — cosine warmdown bad again
r71_g3_rollback_wd015	spsa	d2_e128_p8	curriculum_0.67	eps1e-2_np100_f48_lr1e-1_wd015_rollback	201.92	checkpoint rollback + wd015 — BEST! Auto-recovers from divergence
r70b_g2_t_coupled_wd015	spsa	d2_e128_p8	curriculum_0.67	eps1e-2_np100_f48_lr1e-1_wd015_tcoupled	205.25	t_coupled eps schedule — worse than fixed eps
r70b_g4_cosine_wd015	spsa	d2_e128_p8	curriculum_0.67	eps1e-2_np100_f48_lr1e-1_wd015_cosine	207.15	cosine LR schedule with wd015 — worse than linear warmdown
71ba7a8	0.0000	0.7	crash	topk50 (R72) — DIVERGED at 21.1%! Top-K amplifies outlier perturbations
71ba7a8	205.2505	0.7	discard	R70b t_coupled epsilon schedule + wd=0.15 — not helpful
71ba7a8	201.9204	0.7	keep	R71 checkpoint-rollback + wd=0.15 — sub-202! rollback helps stability
71ba7a8	207.1483	0.7	discard	R70b cosine wd=0.15 — cosine warmdown still bad, but better with wd015 than wd030
71ba7a8	203.0131	0.7	keep	rollback + wd012 (R71) — rollback doesn't improve wd012 as much as wd015
71ba7a8	0.0000	0.7	crash	topk30 (R72) — DIVERGED at 28.0%! Top-K scaling too aggressive for SPSA
r71_g0_rollback_wd012	spsa	d2_e128_p8	curriculum_0.67	eps1e-2_np100_f48_lr1e-1_wd012_rollback	203.01	checkpoint rollback + wd012 — decent, wd015+rollback was better (201.92)
71ba7a8	203.0131	0.7	discard	R71 checkpoint-rollback + wd=0.12 — worse than rollback + wd=0.15 (201.92)
71ba7a8	204.3968	0.7	discard	R70b cosine warmdown wd=0.30 — cosine warmdown consistently worse
71ba7a8	202.1869	0.7	keep	R70b loss-explosion-guard + wd=0.30 — competitive! guard prevents divergent gradient updates
71ba7a8	263.4846	0.7	discard	R71 curriculum_weighted T schedule — terrible! geometric weighting worse than linear ramp
71ba7a8	207.2774	0.7	discard	R71 warmup=0.05 — small warmup hurts (default 0.10 better)
71ba7a8	204.4183	0.7	discard	R71 warmup=0.20 — longer warmup slightly worse than default
71ba7a8	313.2019	0.7	discard	R71 T=1 fixed only — never trains with T>1, terrible FID confirms curriculum T ramp essential
r71_g0_weighted	spsa	d2_e128_p8	curriculum_weighted	eps1e-2_np100_f48_lr1e-1_wd015	263.48	curriculum_weighted schedule — terrible, geometric weight distribution too extreme
r71_g2_t1_only	spsa	d2_e128_p8	curriculum_0.67	eps1e-2_np100_f48_lr1e-1_wd015_tmax1	313.20	T=1 only (no T ramp) — confirms T>1 exposure essential. GPU-contended (~5 img/sec)
r71_g3_warmup005	spsa	d2_e128_p8	curriculum_0.67	eps1e-2_np100_f48_lr1e-1_wd015_warmup005	207.28	LR warmup 0.5% — slightly worse, warmup wastes early steps
r71_g4_warmup020	spsa	d2_e128_p8	curriculum_0.67	eps1e-2_np100_f48_lr1e-1_wd015_warmup020	204.42	LR warmup 2% — minimal effect, small warmup not harmful
r72_g6_antithetic	spsa	d2_e128_p8	curriculum_0.67	eps1e-2_np100_f48_lr1e-1_wd015_antithetic	241.93	antithetic perturbations — BAD again (GPU-contended ~48 img/sec shared)
71ba7a8	0.0000	0.0	discard	R75 curriculum_weighted (killed — already known terrible from R71: 263 FID)
71ba7a8	241.9343	0.7	discard	R72 antithetic perturbations — terrible (241 vs 202 baseline), antithetic confirmed bad with curriculum
71ba7a8	308.3926	0.7	discard	R71 T=1 fixed (second run) — confirms T=1 only gives 308-313, curriculum ramp essential
71ba7a8	241.9343	0.7	discard	antithetic SPSA (R72) — TERRIBLE! Halved unique directions = worse gradient
71ba7a8	263.4846	0.7	discard	weighted perturbations (R71 other) — bad
71ba7a8	308.3926	0.7	discard	T=1 only, no curriculum (R71 other) — terrible without T ramp
71ba7a8	313.2019	0.7	discard	T=1 only, no curriculum run2 (R71 other) — confirms T=1 alone bad
71ba7a8	207.2774	0.7	keep	warmup_ratio=0.05 (R71 other) — worse than default warmup
71ba7a8	204.4183	0.7	keep	warmup_ratio=0.20 (R71 other) — decent but not better than wd015
r71_g0_weighted	spsa	d2_e128_p8	curriculum_0.67	eps1e-2_np100_f48_lr1e-1_wd015_weighted	263.48	curriculum_weighted — discrete T phases BAD for SPSA
r71_g3_warmup005	spsa	d2_e128_p8	curriculum_0.67	eps1e-2_np100_f48_lr1e-1_wd015_warmup005	207.28	warmup=0.05 — less warmup hurts
r71_g4_warmup020	spsa	d2_e128_p8	curriculum_0.67	eps1e-2_np100_f48_lr1e-1_wd015_warmup020	204.42	warmup=0.20 — same as 0.10
71ba7a8	0.0000	0.0	crash	R75 sign-update (signSGD) — DIVERGED, sign of noisy SPSA gradient not reliable enough
r71_g1_t1_only	spsa	d2_e128_p8	curriculum_0.67	eps1e-2_np100_f48_lr1e-1_wd015_tmax1	308.39	T=1 only (seed 2) — terrible, GPU-contended. Confirms T>1 ramp essential
71ba7a8	0.0000	0.0	crash	R75 guided-pert=0.2 — DIVERGED at 34.1%, loss spiked 0.71→2.45. Guided perturbations destabilize.
r71_g7_lottery2	spsa	d2_e128_p8	curriculum_0.67	eps1e-2_np100_f48_lr1e-1_wd015	203.74	lottery seed 2 — more variance data for wd015 baseline
r75_g5_dual_t	spsa	d2_e128_p8	curriculum_0.67	eps1e-2_np100_f48_lr1e-1_wd015_dual_t	212.84	dual-T (half T=1, half curriculum) — WORSE, T=1 perts dilute higher-T gradients
r72_g5_polish05	spsa	d2_e128_p8	curriculum_0.67	eps1e-2_np100_f48_lr1e-1_wd015_polish05	264.92	curriculum polish 5% — TERRIBLE, dropping to T=1 at end destroys T>1 learning
71ba7a8	264.9164	0.7	discard	curriculum_polish 5% (R72) — TERRIBLE! T=1 polish ruins multi-step model
71ba7a8	264.9164	0.7	discard	R72 curriculum-polish=0.05 — TERRIBLE, going back to T=1 at end ruins T=4 training
71ba7a8	203.1322	0.7	keep	R72 lottery1 (standard config repro) — confirms baseline ~203
71ba7a8	214.0232	0.7	discard	R72 lottery2 — high variance run, confirms np=100 instability
r72_g5_lottery1	spsa	d2_e128_p8	curriculum_0.67	eps1e-2_np100_f48_lr1e-1_wd015	203.13	lottery run
r72_g6_lottery2	spsa	d2_e128_p8	curriculum_0.67	eps1e-2_np100_f48_lr1e-1_wd015	214.02	lottery run — unlucky
r71_g7_lottery2	spsa	d2_e128_p8	curriculum_0.67	eps1e-2_np100_f48_lr1e-1_wd015	203.74	lottery run
r71_g1_t1_only_INVALID	INVALID	GPU_SHARED	T1only	only_600steps	308.39	INVALID — GPU contention
r70b_g1_cosine_wd030	spsa	d2_e128_p8	curriculum_0.67	eps1e-2_np100_f48_lr1e-1_wd030_cosine	204.40	cosine LR schedule with wd030 — slightly worse than linear, consistent with previous
r70b_g7_guard_wd030	spsa	d2_e128_p8	curriculum_0.67	eps1e-2_np100_f48_lr1e-1_wd030_guard	202.19	explosion guard + wd030 — competitive! Guard prevents bad updates
r75_g2_smooth_cur	spsa	d2_e128_p8	curriculum_smooth	eps1e-2_np100_f48_lr1e-1_wd015	215.69	smooth curriculum (stochastic T rounding) — worse than discrete T transitions
r75_g3_phased	spsa	d2_e128_p8	phased	eps1e-2_np100_f48_lr1e-1_wd015	260.56	phased T schedule — terrible, sequential phases with LR restart fails
71ba7a8	215.6855	0.7	discard	R75 curriculum_smooth — stochastic T rounding makes it worse (215 vs 202), mixing T values hurts
71ba7a8	260.5618	0.7	discard	R75 phased T — equal time at each T level terrible (260), confirms heavy T=1 weighting essential
71ba7a8	315.7218	0.7	discard	R72 grad-verify — gradient verification overhead + contention = terrible
71ba7a8	315.7218	0.7	discard	grad-verify (R72) — CATASTROPHIC! Reverting "bad" steps prevents exploration
r72_g5_grad_verify	spsa	d2_e128_p8	curriculum_0.67	eps1e-2_np100_f48_lr1e-1_wd015_gradverify	315.72	gradient verification — TERRIBLE, extra forward pass per step halves step count
r75_g1_cosine_steps	spsa	d2_e128_p8	curriculum_0.67	eps1e-2_np100_f48_lr1e-1_wd015_cossteps	202.80	cosine step-wise loss — decent, near baseline
