commit	val_fid	memory_gb	status	description
f3bb5e2	152.4092	1.2	keep	baseline backprop depth=1 lr=1e-4
f3bb5e2	127.4646	1.5	keep	backprop depth=2
f3bb5e2	97.7291	2.8	keep	backprop depth=4 (best round 1)
f3bb5e2	128.6582	1.2	keep	backprop lr=3e-4
f3bb5e2	139.5766	1.3	keep	backprop n_embd=1024
f3bb5e2	184.3847	1.2	discard	backprop batch_size=512
f3bb5e2	0.000000	0.0	crash	SPSA curvature (BFloat16 FID crash)
f3bb5e2	317.1046	1.1	discard	SPSA baseline (zero-order much worse than backprop)
f3bb5e2	0.000000	0.0	crash	depth=4 lr=1e-3 (loss diverged to 10.08)
f3bb5e2	66.9908	3.5	keep	depth=4 lr=5e-4 (best round 2!)
f3bb5e2	73.2451	3.5	keep	depth=4 lr=3e-4
f3bb5e2	85.5588	4.9	keep	depth=4 n_embd=1024
f3bb5e2	92.5277	6.6	keep	depth=8
f3bb5e2	92.3444	5.1	keep	depth=6
f3bb5e2	97.9514	3.5	discard	depth=4 weight_decay=0.01 (no improvement)
f3bb5e2	142.0503	3.0	discard	depth=8 n_embd=384 (too narrow)
f3bb5e2	302.4093	3.5	discard	depth=4 lr=7e-4 (loss diverged)
f3bb5e2	58.1145	5.1	keep	depth=6 lr=5e-4 (BEST! round 3)
f3bb5e2	60.7805	6.6	keep	depth=8 lr=3e-4
f3bb5e2	65.1543	5.1	keep	depth=6 lr=3e-4
f3bb5e2	69.1760	3.5	discard	depth=4 lr=4e-4
f3bb5e2	74.7440	3.5	discard	depth=4 lr=6e-4
f3bb5e2	304.8002	4.9	discard	depth=4 lr=5e-4 n_embd=1024 (diverged)
f3bb5e2	88.5673	11.6	discard	depth=4 lr=5e-4 patch_size=2 (worse FID + high VRAM)
f3bb5e2	61.9527	5.1	discard	depth=6 lr=4e-4 (lr=5e-4 was better)
f3bb5e2	56.0217	6.6	keep	depth=8 lr=5e-4 (BEST! round 4)
f3bb5e2	57.0587	6.6	keep	depth=8 lr=4e-4
f3bb5e2	60.7283	5.1	discard	depth=6 lr=5e-4 weight_decay=0.01
f3bb5e2	62.2871	8.3	discard	depth=10 lr=3e-4
f3bb5e2	70.0590	5.1	discard	depth=6 lr=5e-4 bs=512
f3bb5e2	71.6007	5.1	discard	depth=6 lr=6e-4
f3bb5e2	73.6043	9.8	discard	depth=12 lr=2e-4
f3bb5e2	63.8813	7.2	discard	depth=6 n_embd=1024 lr=3e-4
f3bb5e2	51.9657	6.6	keep	depth=8 lr=5e-4 beta2=0.95 (BEST! round 5)
f3bb5e2	54.8613	6.6	keep	depth=8 lr=5e-4 warmup=0.05 warmdown=0.1
f3bb5e2	55.0034	6.6	keep	depth=8 lr=5e-4 warmdown=0.15
f3bb5e2	56.2056	6.6	discard	depth=8 lr=5e-4 head_dim=32
f3bb5e2	56.7443	6.6	discard	depth=8 lr=5e-4 dbs=32
f3bb5e2	61.0249	8.3	discard	depth=10 lr=5e-4
f3bb5e2	64.1657	6.6	discard	depth=8 lr=6e-4
f3bb5e2	63.9846	4.1	discard	depth=8 lr=5e-4 n_embd=512 (narrower=worse)
9468c42	49.9212	6.6	keep	depth=8 lr=7e-4 beta2=0.95 (BEST! round 6)
9468c42	51.8151	6.6	keep	depth=8 lr=5e-4 beta2=0.95 weight_decay=0.01
9468c42	52.0494	6.6	discard	depth=8 lr=5e-4 beta2=0.95 beta1=0.85
9468c42	52.1839	6.6	discard	depth=8 lr=5e-4 beta2=0.95 warmdown=0.15
9468c42	52.5227	6.6	discard	depth=8 lr=5e-4 beta2=0.95 warmup=0.05 warmdown=0.1
9468c42	52.7001	8.3	discard	depth=10 lr=5e-4 beta2=0.95
9468c42	53.3260	6.6	discard	depth=8 lr=5e-4 beta2=0.85
f3bb5e2	54.7291	7.5	discard	SwiGLU depth=8 lr=5e-4 beta2=0.95 (worse than GELU)
f3bb5e2	49.0283	6.8	keep	depth=8 lr=8e-4 beta2=0.95 (BEST! round 7)
f3bb5e2	49.7274	6.8	keep	depth=8 lr=7e-4 beta2=0.95 beta1=0.85
f3bb5e2	49.7657	6.8	keep	depth=8 lr=7e-4 beta2=0.95 warmup=0.05
f3bb5e2	49.7695	6.8	keep	depth=8 lr=7e-4 beta2=0.95 warmdown=0.15
f3bb5e2	50.4912	8.4	discard	depth=10 lr=7e-4 beta2=0.95
f3bb5e2	50.5126	6.8	discard	depth=8 lr=7e-4 beta2=0.95 wd=0.01
f3bb5e2	51.0608	6.8	discard	depth=8 lr=7e-4 beta2=0.90
964387a	49.3580	22.4	keep	depth=8 lr=8e-4 beta2=0.95 wd=0.05 (R8, I/O contention)
964387a	50.1104	22.4	discard	depth=8 lr=1e-3 beta2=0.95 (R8)
964387a	50.1785	22.4	discard	depth=8 lr=9e-4 beta2=0.95 (R8)
964387a	50.7567	22.4	discard	depth=8 lr=8e-4 beta2=0.95 beta1=0.85 (R8)
964387a	50.8606	22.4	discard	depth=8 lr=8e-4 beta2=0.95 warmup=0.05 (R8)
964387a	50.9554	22.4	discard	depth=8 lr=8e-4 beta2=0.95 wu+wd (R8)
964387a	51.4935	22.4	discard	depth=8 lr=8e-4 beta2=0.90 (R8)
964387a	51.5686	22.4	discard	depth=8 lr=8e-4 beta2=0.95 warmdown=0.15 (R8)
5450f3b	50.3522	22.4	discard	depth=8 lr=8e-4 beta2=0.95 grad_clip=1.0 (R9)
5450f3b	288.1386	22.4	discard	depth=8 lr=8e-4 beta2=0.95 ema=0.9999+gc=1.0 (EMA broken)
5450f3b	299.4541	22.4	discard	depth=8 lr=8e-4 beta2=0.95 ema=0.9999 (EMA 27% init wts)
5450f3b	320.1337	22.4	discard	depth=8 lr=1e-3 beta2=0.95 ema=0.9999 (EMA too slow)
5450f3b	50.6601	22.4	discard	depth=8 lr=8e-4 beta2=0.95 baseline (R9b, 4GPU contention)
5450f3b	50.9400	22.8	discard	depth=8 lr=8e-4 beta2=0.95 ema=0.99 (R9b)
5450f3b	51.5344	22.8	discard	depth=8 lr=8e-4 beta2=0.95 ema=0.999 (R9b)
5450f3b	55.2036	22.8	discard	depth=8 lr=8e-4 beta2=0.95 ema=0.9995 (R9b)
6b30aa9	49.7998	22.4	keep	depth=8 lr=8e-4 beta2=0.95 linear (R10 baseline)
6b30aa9	52.0244	22.4	discard	depth=8 lr=1e-3 beta2=0.95 cosine+gc1.0 (R10)
6b30aa9	52.0505	22.4	discard	depth=8 lr=1e-3 beta2=0.95 cosine (R10)
6b30aa9	52.9452	22.4	discard	depth=8 lr=8e-4 beta2=0.95 cosine (R10)
6b30aa9	49.3322	11.8	keep	depth=8 lr=8e-4 beta2=0.95 bs=128 (R11, 24k steps!)
6b30aa9	50.6680	22.4	discard	depth=8 lr=8e-4 beta2=0.95 warmdown=0.2 (R11)
6b30aa9	51.0340	22.4	discard	depth=8 lr=8e-4 beta2=0.95 warmdown=0.1 (R11)
6b30aa9	51.8928	22.4	discard	depth=8 lr=8e-4 beta2=0.95 wd=0.2+wu=0.05 (R11)
5732463	49.5366	11.8	keep	depth=8 lr=1e-3 beta2=0.95 bs=128 (R12)
5732463	50.1762	11.8	discard	depth=8 lr=6e-4 beta2=0.95 bs=128 (R12)
5732463	50.4650	11.8	discard	depth=8 lr=5e-4 beta2=0.95 bs=128 (R12)
5732463	51.0047	6.1	discard	depth=8 lr=8e-4 beta2=0.95 bs=64 (R12, too noisy)
a0fe8d4	317.5219	1.0	discard	1.5-SPSA d2 lr=1e-3 np=100 bs=32 T=20 denoising (R13)
a0fe8d4	321.7255	1.0	discard	1.5-SPSA d2 lr=5e-3 np=100 bs=32 T=20 denoising (R13)
a0fe8d4	338.4304	1.0	discard	1.5-SPSA d2 lr=1e-2 np=100 bs=32 T=20 denoising (R13, lowest loss but worst FID)
a0fe8d4	316.8546	1.0	discard	1.5-SPSA d4 lr=1e-3 np=100 bs=32 T=20 denoising (R13)
a0fe8d4	316.7010	1.0	discard	1.5-SPSA d4 lr=5e-3 np=100 bs=32 T=20 denoising (R13)
a0fe8d4	317.5023	1.0	discard	1.5-SPSA d2 lr=1e-3 np=100 bs=32 T=50 denoising (R13)
a0fe8d4	317.6195	1.0	discard	1.5-SPSA d2/384w lr=1e-3 np=100 bs=32 T=20 denoising (R13)
a0fe8d4	316.7620	1.0	discard	1.5-SPSA d4/384w lr=5e-3 np=100 bs=32 T=20 denoising (R13)
a0fe8d4	375.5920	1.0	discard	1.5-SPSA d1/384w lr=1e-2 np=100 bs=32 T=20 denoising (R14)
a0fe8d4	366.4449	1.0	discard	1.5-SPSA d1/384w lr=3e-2 np=100 bs=64 T=20 denoising (R14)
a0fe8d4	384.6778	1.0	discard	1.5-SPSA d1/384w lr=3e-2 np=100 bs=32 T=50 denoising (R14)
6698025	316.7957	0.6	discard	1.5-SPSA traj d2 lr=5e-4 np=100 bs=32 T=20 (R17)
6698025	316.9685	0.7	discard	1.5-SPSA traj d4 lr=5e-4 np=100 bs=32 T=20 (R17)
6698025	316.9231	0.6	discard	1.5-SPSA prog d2 lr=5e-4 np=100 bs=32 T=20 (R17)
6698025	316.7857	0.7	discard	1.5-SPSA prog d4 lr=5e-4 np=100 bs=32 T=20 (R17)
6698025	317.4063	0.6	discard	1.5-SPSA traj d2 lr=1e-3 np=100 bs=32 T=20 (R17)
6698025	317.0028	0.6	discard	1.5-SPSA prog d2 lr=1e-3 np=100 bs=32 T=20 (R17)
6698025	320.5877	0.6	discard	1.5-SPSA traj d2 lr=5e-3 np=100 bs=32 T=20 (R17, -31% loss but WORSE FID!)
6698025	318.2799	0.6	discard	1.5-SPSA prog d2 lr=5e-3 np=100 bs=32 T=20 (R17)
f336bab	0.000000	0.0	crash	1.5-SPSA d1/e64/p8 prog T=5 lr=1e-2 Xavier (R18 KILLED by competing process at step 750)
f336bab	0.000000	0.0	crash	1.5-SPSA d1/e128/p8 prog T=5 lr=1e-2 Xavier (R18 KILLED -34% loss in 813 steps!)
f336bab	0.000000	0.0	crash	1.5-SPSA d1/e64/p8 prog T=5 lr=2e-2 Xavier (R18 KILLED -25% loss in 827 steps!)
f336bab	0.000000	0.0	crash	1.5-SPSA d1/e64/p8 prog T=5 lr=1e-2 ZERO-INIT control (R18 only -0.9% loss = zero-init is broken)
f794969	316.9191	0.6	discard	1.5-SPSA d2 nozero lr=1e-2 np=100 T=20 denoising (R18b)
f794969	324.9465	0.6	discard	1.5-SPSA d2 nozero layerwise lr=1e-2 np=100 T=20 (R18b)
f794969	322.2716	0.6	discard	1.5-SPSA d2 nozero lr=1e-2 np=100 T=20 (R18b)
f794969	323.5478	0.6	discard	1.5-SPSA d2 nozero layerwise lr=1e-2 np=100 T=20 (R18b)
f794969	347.1248	0.6	discard	1.5-SPSA d2 nozero T=5 lr=1e-2 np=100 (R18b, fewer steps=worse)
f794969	316.3928	0.6	discard	1.5-SPSA d2 nozero T=5 lr=5e-2 np=100 (R18b)
f794969	320.2758	0.6	discard	1.5-SPSA d2 nozero lr=1e-2 np=100 T=20 (R18b)
f794969	323.5845	0.6	discard	1.5-SPSA d2 nozero lr=1e-2 np=100 T=20 (R18b)
2dd9427	0.000000	0.0	crash	1.5-SPSA contrastive d2 lr=1e-2 T=5 (R19, killed early - converged to ln(B))
2dd9427	0.000000	0.0	crash	1.5-SPSA contrastive d1 lr=2e-2 T=5 (R19, converged to ln(B)=3.47)
2dd9427	0.000000	0.0	crash	1.5-SPSA contrastive lr=5e-2 T=5 (R19, converged to ln(B))
88dc702	0.000000	0.0	crash	1.5-SPSA combo d2 lr=1e-2 T=5 (R20, killed - MSE dominates, mean pred)
88dc702	0.000000	0.0	crash	1.5-SPSA rank d2 lr=1e-2 T=5 (R20, killed - MSE dominates)
88dc702	317.4585	0.6	discard	1.5-SPSA d1/e64/p16 lr=1e-1 T=5 denoising (R21 tiny model)
88dc702	317.1324	0.6	discard	1.5-SPSA d1/e64/p16 lr=5e-2 T=5 denoising (R21 tiny)
88dc702	388.7952	0.6	discard	1.5-SPSA d1/e64/p16 lr=1e-1 T=5 contrastive (R21, WORSE than random)
88dc702	317.7661	0.6	discard	1.5-SPSA d1/e128/p8 lr=5e-2 T=5 denoising (R21 small)
88dc702	316.7375	0.6	discard	1.5-SPSA d1/e64/p16 lr=1e-1 np=500 T=5 denoising (R21)
88dc702	316.8497	0.6	discard	1.5-SPSA d1/e64/p16 lr=1e-1 T=5 progressive (R21)
88dc702	0.000000	0.0	crash	1.5-SPSA d1/e64/p16 lr=2e-1 T=5 denoising (R21, FAIL at step 0)
88dc702	317.2984	0.6	discard	1.5-SPSA d1/e64/p16 lr=1e-1 T=5 bs=1 denoising (R21)
aa11224	316.5929	0.6	discard	1.5-SPSA d1/e64/p8 prog T=5 lr=2e-2 Xavier 30min (R19d FID=317 despite -28% loss)
aa11224	256.2836	0.6	keep	1.5-SPSA d1/e64/p8 TEACHER lr=2e-2 Xavier 30min (R19e FIRST BELOW 317! 4053 steps)
aa11224	320.8231	0.6	discard	1.5-SPSA MMD pixel d2 lr=1e-2 T=5 (R22)
aa11224	324.8794	0.6	discard	1.5-SPSA MMD pixel d1 lr=5e-2 T=5 (R22)
aa11224	316.6536	0.6	discard	1.5-SPSA MMD pixel d1/e64/p16 lr=1e-1 T=5 (R22)
aa11224	0.000000	0.0	crash	1.5-SPSA MMD inception d2 lr=1e-2 (R22, InceptionV3 not loaded)
aa11224	321.9420	0.6	discard	1.5-SPSA MMD pixel d2 lr=5e-2 T=5 (R22)
aa11224	321.8084	0.6	discard	1.5-SPSA MMD pixel d2 lr=1e-2 T=10 (R22)
aa11224	364.0508	0.6	discard	1.5-SPSA denoising d2 lr=1e-2 T=5 nozero (R22 control, WORSE than random!)
aa11224	322.2827	0.6	discard	1.5-SPSA MMD pixel d2 lr=1e-2 np=200 T=5 (R22)
eff3d62	294.7312	0.6	keep	1.5-SPSA d1/e64/p16 lr=1e-1 eps=1e-2 T=5 fixed=1 (R24b BEST SPSA! overfit 1 image)
eff3d62	315.8413	0.6	discard	1.5-SPSA d1/e64/p16 lr=1e-1 eps=1e-2 T=5 fixed=32 (R24b)
eff3d62	317.3087	0.6	discard	1.5-SPSA d1/e64/p16 lr=1e-1 eps=1e-2 T=5 fixed=100 (R24b)
eff3d62	317.8949	0.6	discard	1.5-SPSA d1/e64/p16 lr=1e-1 eps=1e-2 T=5 fixed=1000 (R24b)
eff3d62	316.9602	0.6	discard	1.5-SPSA d1/e64/p16 lr=1e-1 eps=1e-2 T=5 no-fixed (R24b control)
eff3d62	316.3943	0.6	discard	1.5-SPSA d1/e64/p16 lr=5e-2 eps=1e-2 T=5 fixed=32 (R24b)
eff3d62	311.1406	0.6	keep	1.5-SPSA d2/e128/p8 lr=5e-2 eps=1e-2 T=5 fixed=32 (R24b, FID below 317!)
eff3d62	296.9459	0.6	keep	1.5-SPSA d2/e384 lr=1e-2 eps=1e-3 T=5 fixed=1 (R24b, overfit 1 image)
f9e9651	287.1471	0.6	keep	1.5-SPSA d1/e64/p8 TEACHER lr=2e-2 Xavier 5min 606 steps (R20c)
f9e9651	259.2990	0.6	keep	1.5-SPSA d1/e64/p8 TEACHER lr=5e-2 Xavier 30min 3553 steps (R20d)
f9e9651	303.6224	0.1	discard	SPSA d2/e128/p8 lr=5e-2 eps=1e-2 T=5 fixed=32 cycle 1h (R25)
f9e9651	0.000000	0.0	crash	SPSA d2/e128/p8 lr=5e-2 eps=1e-2 T=5 fixed=16 cycle 1h DIVERGED (R25)
f9e9651	265.2612	0.1	keep	SPSA d2/e128/p8 lr=5e-2 eps=1e-2 T=5 fixed=8 cycle 1h (R25)
f9e9651	265.6616	0.1	keep	SPSA d2/e128/p8 lr=5e-2 eps=1e-2 T=5 fixed=4 cycle 1h (R25)
f9e9651	252.8260	0.1	keep	SPSA d2/e128/p8 lr=5e-2 eps=1e-2 T=5 fixed=1 overfit 1h (R25)
f9e9651	315.2428	0.1	discard	SPSA d4/e128/p8 lr=5e-2 eps=1e-2 T=5 fixed=64 cycle 1h (R25)
f9e9651	308.3048	0.1	discard	SPSA d4/e128/p8 lr=5e-2 eps=1e-2 T=5 fixed=32 cycle 1h (R25)
f9e9651	311.0526	0.1	discard	SPSA d2/e128/p8 lr=5e-2 eps=1e-2 T=5 fixed=32 cycle progressive 1h (R25)
3e68717	302.6142	0.6	discard	SPSA d2/e128/p8 lr=5e-2 eps=1e-2 T=5 fixed=32 ALL-AT-ONCE 1h (R26)
3e68717	236.0989	0.6	keep	SPSA d2/e128/p8 lr=5e-2 eps=1e-2 T=2 fixed=32 ALL-AT-ONCE 1h (R26 BEST SPSA!)
6fb8aaf	313.5575	0.6	discard	SPSA d2/e128/p8 lr=5e-2 T=2 SSIM loss curvature fixed=32 all 1h (R29)
6fb8aaf	319.9046	0.6	discard	SPSA d2/e128/p8 lr=5e-2 T=2 FFT spectral loss curvature fixed=32 all 1h (R29)
6fb8aaf	311.7163	0.6	discard	SPSA d2/e128/p8 lr=5e-2 T=2 SSIM+MSE loss curvature fixed=32 all 1h (R29)
6fb8aaf	314.5077	0.6	discard	SPSA d2/e128/p8 lr=5e-2 T=2 multiscale loss curvature fixed=32 all 1h (R29)
6fb8aaf	0.000000	0.0	crash	SPSA d2/e128/p8 lr=5e-2 T=2 direct_fid loss curvature (R29, 5min/step too slow)
6fb8aaf	311.8588	0.6	discard	SPSA d2/e128/p8 lr=5e-2 T=1 SSIM loss curvature fixed=32 all 1h (R29)
6fb8aaf	316.4201	0.6	discard	SPSA d2/e128/p8 lr=5e-2 FFT curriculum T=1→10 curvature fixed=32 all 1h (R29)
6fb8aaf	314.7382	0.6	discard	SPSA d2/e128/p8 lr=5e-2 SSIM curriculum T=1→10 curvature fixed=32 all 1h (R29)
97e2782	313.5575	0.6	discard	SPSA SSIM loss T=2 fixed=32 all (loss flat ~0.997 but FID < random)
97e2782	319.9046	0.6	discard	SPSA FFT spectral loss T=2 fixed=32 all (FFT loss decreases but FID worse)
97e2782	311.7163	0.6	discard	SPSA SSIM+MSE T=2 fixed=32 all (MSE drives learning, SSIM adds guidance)
97e2782	314.5077	0.6	discard	SPSA multiscale MSE T=2 fixed=32 all
97e2782	0.000000	0.0	crash	SPSA direct_fid T=2 fixed=32 all (5 min/step, too slow for inception)
97e2782	311.8588	0.6	discard	SPSA SSIM T=1 fixed=32 all (simpler ODE)
97e2782	316.4201	0.6	discard	SPSA FFT curriculum T=1->10 fixed=32 all
97e2782	314.7382	0.6	discard	SPSA SSIM curriculum T=1->10 fixed=32 all
97e2782	313.5575	0.6	discard	R29 SSIM loss T=2 d2/e128 curvature lr=5e-2 fixed32
97e2782	319.9046	0.6	discard	R29 FFT spectral loss T=2 d2/e128 curvature lr=5e-2 fixed32
97e2782	311.7163	0.6	discard	R29 SSIM+MSE loss T=2 d2/e128 curvature lr=5e-2 fixed32
97e2782	314.5077	0.6	discard	R29 multiscale loss T=2 d2/e128 curvature lr=5e-2 fixed32
97e2782	311.8588	0.6	discard	R29 SSIM loss T=1 d2/e128 curvature lr=5e-2 fixed32
97e2782	316.4201	0.6	discard	R29 FFT curriculum T=1->10 d2/e128 curvature lr=5e-2 fixed32
97e2782	314.7382	0.6	discard	R29 SSIM curriculum T=1->10 d2/e128 curvature lr=5e-2 fixed32
97e2782	0.000000	0.0	crash	R29 direct FID loss T=2 too slow (311s/step)
97e2782	317.2646	0.6	discard	R29 multiscale loss lognormal T (mu=1.5 s=0.8) d2/e128 curvature lr=5e-2 fixed32
97e2782	317.2646	0.6	discard	R29 multiscale loss lognormal T curvature d2/e128 lr=5e-2 fixed32 (3hr contention)
b237a95	313.6261	0.6	discard	R30 denoising T=2 curvature lr=5e-2 fixed32 all (control)
b237a95	315.0468	0.6	discard	R30 denoising lognormal(mu=1 sigma=0.5) curvature lr=5e-2 fixed32
b237a95	316.5338	0.6	discard	R30 denoising lognormal(mu=2 sigma=1) curvature lr=5e-2 fixed32
b237a95	316.7141	0.6	discard	R30 denoising T=2 curvature lr=1e-1 fixed32
b237a95	317.2990	0.6	discard	R30 denoising linear(2->20) curvature lr=5e-2 fixed32
b237a95	317.1406	0.6	discard	R30 warmup30 SSIM curvature lr=5e-2 fixed32
b237a95	315.2330	0.6	discard	R30 warmup30 multiscale curvature lr=5e-2 fixed32
b237a95	315.9408	0.6	discard	R30 warmup30 multiscale lognormal curvature lr=5e-2 fixed32
97e2782	315.0468	0.6	discard	R30 MSE denoising lognormal T (mu=1 s=0.5) curvature lr=5e-2 fixed32
97e2782	316.5338	0.6	discard	R30 MSE denoising lognormal T (mu=2 s=1) curvature lr=5e-2 fixed32
97e2782	317.1406	0.6	discard	R30 warmup MSE->SSIM 30% curvature lr=5e-2 fixed32
97e2782	315.2330	0.6	discard	R30 warmup MSE->multiscale 30% curvature lr=5e-2 fixed32
97e2782	316.7141	0.6	discard	R30 MSE denoising lr=1e-1 curvature fixed32
97e2782	313.6261	0.6	discard	R30 MSE denoising T=2 curvature lr=5e-2 fixed32 (control)
97e2782	317.2990	0.6	discard	R30 MSE denoising linear T 2->20 curvature lr=5e-2 fixed32
97e2782	315.9408	0.6	discard	R30 warmup MSE->multiscale + lognormal T curvature lr=5e-2 fixed32
97e2782	313.6261	0.6	discard	SPSA d2/e128/p8 MSE T=2 curvature lr=eps=5e-2 fixed=32 all 1h (R30 control - MUCH worse than R26!)
97e2782	315.0468	0.6	discard	SPSA d2/e128/p8 MSE lognormal(1,0.5) curvature lr=eps=5e-2 fixed=32 all 1h (R30)
97e2782	316.5338	0.6	discard	SPSA d2/e128/p8 MSE lognormal(2,1) curvature lr=eps=5e-2 fixed=32 all 1h (R30)
97e2782	316.7141	0.6	discard	SPSA d2/e128/p8 MSE T=2 curvature lr=eps=1e-1 fixed=32 all 1h (R30)
97e2782	317.2990	0.6	discard	SPSA d2/e128/p8 MSE linear 2→20 curvature lr=eps=5e-2 fixed=32 all 1h (R30)
97e2782	317.1406	0.6	discard	SPSA d2/e128/p8 warmup30%→SSIM curvature lr=eps=5e-2 fixed=32 all 1h (R30)
97e2782	315.2330	0.6	discard	SPSA d2/e128/p8 warmup30%→multiscale curvature lr=eps=5e-2 fixed=32 all 1h (R30)
97e2782	315.9408	0.6	discard	SPSA d2/e128/p8 warmup30%→multiscale+lognormal curvature lr=eps=5e-2 fixed=32 all 1h (R30)
97e2782	278.3584	0.6	discard	R31 MSE denoising no curvature lr=5e-2 eps=1e-2 fixed32 (control)
97e2782	293.4496	0.6	discard	R31 MSE denoising WITH curvature lr=5e-2 eps=1e-2 fixed32
97e2782	313.7050	0.6	discard	R31 MSE denoising curvature tied lr=eps=5e-2 fixed32 (worst)
97e2782	242.0410	0.6	discard	R31 MSE lognormal T (mu=1 s=0.5) no curvature lr=5e-2 eps=1e-2 fixed32
97e2782	251.4463	0.6	discard	R31 MSE lr=1e-1 eps=1e-2 no curvature fixed32
97e2782	285.3327	0.6	discard	R31 MSE lr=5e-2 eps=5e-3 no curvature fixed32
97e2782	227.0251	0.6	keep	R31 SSIM+MSE no curvature lr=5e-2 eps=1e-2 fixed32 (NEW BEST SPSA!)
97e2782	250.9215	0.6	discard	R31 warmup MSE->multiscale no curvature lr=5e-2 eps=1e-2 fixed32
97e2782	253.3235	0.6	discard	SPSA d2/e128/p8 R26 control lr=5e-2 eps=1e-2 T=2 fixed=32 all 1h (R31, GPU contention)
97e2782	242.4574	0.6	keep	SPSA d2/e128/p8 lognormal(1,0.5) lr=5e-2 eps=1e-2 fixed=32 all 1h (R31)
97e2782	210.9856	0.6	keep	SPSA d2/e128/p8 linear T=1→5 lr=5e-2 eps=1e-2 fixed=32 all 1h (R31 NEW BEST SPSA!)
97e2782	299.0853	0.6	discard	SPSA d2/e128/p8 linear T=2→10 lr=5e-2 eps=1e-2 fixed=32 all 1h (R31, T too high)
97e2782	258.6049	0.6	discard	SPSA d2/e128/p8 warmup30%→multiscale lr=5e-2 eps=1e-2 fixed=32 all 1h (R31)
97e2782	225.9250	0.6	keep	SPSA d2/e128/p8 warmup30%→SSIM+MSE lr=5e-2 eps=1e-2 fixed=32 all 1h (R31)
97e2782	264.2437	0.6	discard	SPSA d2/e128/p8 T=1 lr=5e-2 eps=1e-2 fixed=32 all 1h (R31, doesn't generalize)
97e2782	276.0149	0.6	discard	SPSA d2/e128/p8 T=2 lr=1e-1 eps=1e-2 fixed=32 all 1h (R31, LR too high)
97e2782	213.1582	0.6	keep	SPSA d2/e128/p8 linear T=1→3 lr=5e-2 eps=1e-2 fixed=32 all 1h (R32b, tight range)
97e2782	215.0349	0.6	keep	SPSA d2/e128/p8 linear T=1→5 lr=5e-2 eps=1e-2 fixed=32 all 1h (R32b repro, contention)
97e2782	220.7120	0.6	keep	SPSA d2/e128/p8 warmup30→SSIM+MSE linear T=1→5 lr=5e-2 eps=1e-2 fixed=32 all 1h (R32b)
97e2782	243.4562	0.6	discard	SPSA d2/e128/p8 lognormal(0.5,0.5) lr=5e-2 eps=1e-2 fixed=32 all 1h (R32b)
97e2782	257.5064	0.6	discard	SPSA d2/e128/p8 linear T=2→5 lr=5e-2 eps=1e-2 fixed=32 all 1h (R32b, T=1 start critical)
97e2782	261.8787	0.6	discard	SPSA d2/e128/p8 linear T=1→7 lr=5e-2 eps=1e-2 fixed=32 all 1h (R32b, too wide)
97e2782	264.3427	0.6	discard	SPSA d2/e128/p8 warmup30→multiscale linear T=1→5 lr=5e-2 eps=1e-2 fixed=32 all 1h (R32b)
97e2782	314.7593	0.6	discard	SPSA d2/e128/p8 linear T=1→5 bs=64 lr=5e-2 eps=1e-2 fixed=64 all 1h (R32b, bs64 terrible)
3508dbe	205.7596	0.6	keep	R33 SPSA d2/e128/p8 lr=5e-2 eps=1e-2 T linear 1→4 no-curv fixed=32 all (NEW BEST SPSA!)
3508dbe	206.4812	0.6	keep	R33 SPSA d2/e128/p8 lr=8e-2 eps=1e-2 T linear 1→5 no-curv fixed=32 all
3508dbe	209.4590	0.6	keep	R33 SPSA d2/e128/p8 lr=5e-2 eps=1e-2 T linear 1→3 no-curv fixed=32 all
3508dbe	246.2173	0.6	discard	R33 SPSA T linear 1→7 (wider range worse)
3508dbe	248.8540	0.6	discard	R33 SPSA T linear 1→5 multi_step loss
3508dbe	263.7093	0.6	discard	R33 SPSA T linear 1→5 ssim_mse loss
3508dbe	309.2378	0.6	discard	R33 SPSA T linear 1→5 curvature (curvature hurts!)
3508dbe	309.9668	0.6	discard	R33 SPSA T linear 1→5 n_perts=200 (fewer steps bad)
3508dbe	330.2059	0.6	discard	R33 SPSA T linear 1→5 vary-noise (terrible)
b237a95	210.9856	0.6	keep	R31 SPSA T linear 1→5 lr=5e-2 eps=1e-2 no-curv fixed=32 all (other conv)
b237a95	225.9250	0.6	keep	R31 SPSA ssim_mse warmup30% lr=5e-2 eps=1e-2 (other conv)
b237a95	227.0251	0.6	discard	R31 SPSA ssim_mse no-curv lr=5e-2 eps=1e-2 (other conv)
b237a95	242.0410	0.6	discard	R31 SPSA lognormal T mu=1 s=0.5 no-curv eps=1e-2 (other conv)
b237a95	253.3235	0.6	discard	R31 SPSA baseline repro lr=5e-2 eps=1e-2 T=2 (other conv)
b237a95	293.4496	0.6	discard	R31 SPSA curvature eps=1e-2 T=2 (curvature hurts)
b237a95	313.7050	0.6	discard	R31 SPSA curvature tied eps=lr=5e-2 T=2 (terrible)
d335f4c	209.4590	0.6	keep	SPSA d2/e128/p8 linear T=1→3 lr=5e-2 eps=1e-2 fixed=32 all 1h (R33)
d335f4c	205.7596	0.6	keep	SPSA d2/e128/p8 linear T=1→4 lr=5e-2 eps=1e-2 fixed=32 all 1h (R33 NEW BEST SPSA!)
d335f4c	246.2173	0.6	discard	SPSA d2/e128/p8 linear T=1→7 lr=5e-2 eps=1e-2 fixed=32 all 1h (R33, too wide)
d335f4c	263.7093	0.6	discard	SPSA d2/e128/p8 linear T=1→5 ssim_mse lr=5e-2 eps=1e-2 fixed=32 all 1h (R33)
d335f4c	248.8540	0.6	discard	SPSA d2/e128/p8 linear T=1→5 multi_step lr=5e-2 eps=1e-2 fixed=32 all 1h (R33)
d335f4c	206.4812	0.6	keep	SPSA d2/e128/p8 linear T=1→5 lr=8e-2 eps=1e-2 fixed=32 all 1h (R33, higher lr good)
d335f4c	309.2378	0.6	discard	SPSA d2/e128/p8 linear T=1→5 curvature lr=5e-2 eps=1e-2 fixed=32 all 1h (R33)
d335f4c	330.2059	0.6	discard	SPSA d2/e128/p8 linear T=1→5 vary-noise lr=5e-2 eps=1e-2 fixed=32 all 1h (R33, terrible)
d335f4c	309.9668	0.6	discard	SPSA d2/e128/p8 linear T=1→5 n_perts=200 lr=5e-2 eps=1e-2 fixed=32 all 1h (R33, fewer steps)
97e2782	292.5838	0.6	discard	R32 SSIM+MSE lognormal T (mu=1 s=0.5) no curv lr=5e-2 eps=1e-2 fixed32 (contention)
97e2782	0.000000	0.0	crash	R32 SSIM+MSE lr=1e-1 no curv (FAIL at step 811 diverged)
97e2782	299.6584	0.6	discard	R32 SSIM+MSE n_perts=200 no curv lr=5e-2 eps=1e-2 fixed32 (contention)
97e2782	303.1242	0.6	discard	R32 SSIM+MSE depth=4 no curv lr=5e-2 eps=1e-2 fixed32 (contention)
97e2782	312.2961	0.6	discard	R32 pure SSIM no curv lr=5e-2 eps=1e-2 fixed32 (contention)
97e2782	335.0518	0.6	discard	R32 pure FFT no curv lr=5e-2 eps=1e-2 fixed32 (contention)
